{
  "$schema": "https://json-schema.org/draft/2020-12/schema",
  "$id": "https://schemas.kumwe.org/studio/v1/field-adapter.schema.json",
  "title": "Studio field adapter contribution",
  "description": "The declarative payload behind a `field-adapter` plugin contribution: a control an extension offers for editing a declared field kind. The declaration is inert data - it names the control, the field kinds it accepts, the capability its executable half requires, and the bounded option schema an author configures it through. It never carries markup, styles or code.",
  "type": "object",
  "additionalProperties": false,
  "required": [
    "contractVersion",
    "kind",
    "id",
    "version",
    "owner",
    "label",
    "control",
    "fieldKinds"
  ],
  "properties": {
    "contractVersion": { "$ref": "common.schema.json#/$defs/contractVersion" },
    "kind": { "const": "field-adapter" },
    "id": { "$ref": "common.schema.json#/$defs/qualifiedName" },
    "version": { "$ref": "common.schema.json#/$defs/semanticVersion" },
    "owner": { "$ref": "common.schema.json#/$defs/ownerReference" },
    "label": { "$ref": "common.schema.json#/$defs/messageReference" },
    "description": { "$ref": "common.schema.json#/$defs/messageReference" },
    "control": {
      "description": "The control identifier a field's authoring metadata names to select this adapter.",
      "$ref": "common.schema.json#/$defs/qualifiedName"
    },
    "fieldKinds": {
      "description": "The field kinds this control accepts. A field of any other kind never resolves to it.",
      "type": "array",
      "minItems": 1,
      "maxItems": 50,
      "uniqueItems": true,
      "items": { "$ref": "common.schema.json#/$defs/qualifiedName" }
    },
    "optionSchema": {
      "description": "The bounded schema an author's control options validate against, inside the Studio Schema Profile exactly like a contributed block's property schema.",
      "type": "object",
      "maxProperties": 100,
      "propertyNames": { "$ref": "common.schema.json#/$defs/safeJsonMemberName" },
      "additionalProperties": { "$ref": "common.schema.json#/$defs/jsonValue" }
    },
    "requiredCapability": {
      "description": "The capability the executable half requires. A declaration without one is inspectable but never executed.",
      "$ref": "common.schema.json#/$defs/qualifiedName"
    },
    "extensions": { "$ref": "common.schema.json#/$defs/extensions" }
  }
}
