{
  "contractVersion": "0.1-draft",
  "kind": "field-adapter",
  "id": "org.example.catalog/money-control",
  "version": "1.0.0",
  "owner": {
    "id": "org.example/catalog",
    "version": "1.0.0"
  },
  "label": {
    "key": "org.example.catalog/money-control",
    "defaultMessage": "Money control"
  },
  "control": "org.example.control/money",
  "fieldKinds": ["studio.field/money", "studio.field/decimal"],
  "optionSchema": {
    "type": "object",
    "additionalProperties": false,
    "properties": {
      "currencyDisplay": {
        "type": "string",
        "enum": ["code", "symbol"]
      }
    }
  },
  "requiredCapability": "studio.capability/field-controls"
}
